{
  "schemaVersion": 1,
  "artifactHashes": {
    "artifact.html": "1923a389b9007c4d94ee82591b00b2e0f9071a855fddb14196cd42795435e944",
    "artifact.md": "2b352df3507120309ed912bce237100d64cb50a84a07308316d3e9cb26cd2614"
  },
  "viewports": [
    {
      "width": 1366,
      "height": 768,
      "theme": "light",
      "zoom": 1
    },
    {
      "width": 1366,
      "height": 681,
      "theme": "light",
      "zoom": 1
    },
    {
      "width": 320,
      "height": 568,
      "theme": "dark",
      "zoom": 1
    },
    {
      "width": 390,
      "height": 844,
      "theme": "light",
      "zoom": 1
    },
    {
      "width": 844,
      "height": 390,
      "theme": "dark",
      "zoom": 1
    },
    {
      "width": 768,
      "height": 1024,
      "theme": "light",
      "zoom": 1
    },
    {
      "width": 1366,
      "height": 768,
      "theme": "light",
      "zoom": 2
    }
  ],
  "checks": [
    {
      "id": "T09",
      "status": "pass",
      "detail": "passed"
    },
    {
      "id": "T10",
      "status": "pass",
      "detail": "passed"
    },
    {
      "id": "T11",
      "status": "fail",
      "detail": "locator.click: Timeout 30000ms exceeded.\nCall log:\n\u001b[2m  - waiting for locator('details[data-pep-optional]').first().locator(':scope > summary')\u001b[22m\n\u001b[2m    - locator resolved to <summary>…</summary>\u001b[22m\n\u001b[2m  - attempting click action\u001b[22m\n\u001b[2m    2 × waiting for element to be visible, enabled and stable\u001b[22m\n\u001b[2m      - element is not visible\u001b[22m\n\u001b[2m    - retrying click action\u001b[22m\n\u001b[2m    - waiting 20ms\u001b[22m\n\u001b[2m    2 × waiting for element to be visible, enabled and stable\u001b[22m\n\u001b[2m      - element is not visible\u001b[22m\n\u001b[2m    - retrying click action\u001b[22m\n\u001b[2m      - waiting 100ms\u001b[22m\n\u001b[2m    58 × waiting for element to be visible, enabled and stable\u001b[22m\n\u001b[2m       - element is not visible\u001b[22m\n\u001b[2m     - retrying click action\u001b[22m\n\u001b[2m       - waiting 500ms\u001b[22m\n"
    },
    {
      "id": "T12",
      "status": "pass",
      "detail": "passed"
    },
    {
      "id": "T13",
      "status": "pass",
      "detail": "passed"
    },
    {
      "id": "T18",
      "status": "pass",
      "detail": "Markdown parity passed"
    }
  ],
  "passCount": 5,
  "toolVersions": {
    "node": "24.2.0",
    "playwright": "1.55.0",
    "axeCorePlaywright": "4.10.2",
    "chromium": "155.0.8059.84"
  }
}
